referenceFournisseur,constructeur,categoryId,nom_fr,nom_en,description_fr,description_en,ficheTechnique_fr,ficheTechnique_en,pdfBrochureUrl,imageUrls,status,featured
1901-P-7052,keeler,surgery-instruments,Pack de Four Assorted Colour Manche Sleeves,Pack of Four Assorted Colour Handle Sleeves,Add some colour to your diagnostic areaNow available in four funky,Add some colour to your diagnostic areaNow available in four funky,,,,https://www.keelerglobal.com/wp-content/uploads/2024/02/1901-P-7052-16-jpg.webp,active,false
1901-P-7052 slimline,keeler,surgery-instruments,Pack de Four Assorted Colour Slimline Manche Sleeves,Pack of Four Assorted Colour Slimline Handle Sleeves,Add some colour to your diagnostic areaNow available in four funky,Add some colour to your diagnostic areaNow available in four funky,,,,https://www.keelerglobal.com/wp-content/uploads/2024/02/1901-P-7052-17-jpg.webp,active,false
1911-P-1228,keeler,surgery-instruments,Double Lithium Mise à Niveau Kit,Double Lithium Upgrade Kit,2 x Handles et double Lithium ChargerFits neatly into your immediate testing environment allowing easy access to your hand held instruments.the chargeur can be table top ou wall mounted.,2 x Handles and Double Lithium ChargerFits neatly into your immediate testing environment allowing easy access to your hand held instruments.The charger can be table top or wall mounted.,,,,https://www.keelerglobal.com/wp-content/uploads/2024/02/1911-P-1228-8-jpg.webp,active,false
1911-P-1236,keeler,surgery-instruments,Mini Lithium Mise à Niveau Kit,Mini Lithium Upgrade Kit,Small et compact mini chargerThe,Small and compact mini chargerThe,,,,https://www.keelerglobal.com/wp-content/uploads/2024/02/1911-P-1236-7-jpg.webp,active,false
1919-P-1013,keeler,surgery-instruments,Batterie Au Lithium pour Sans Fil Vantage Plus (standard),Lithium Battery for Wireless Vantage Plus (standard),Alimentation your indirect avec easeLithium batterie pour use avec le sans fil Vantage PLus (standard).Features:Fits neatly into le charging unité.Original batterie au lithium lasts up to 11 hours de use.,Power your indirect with easeLithium battery for use with the wireless Vantage PLus (standard).Features:Fits neatly into the charging unit.Original lithium battery lasts up to 11 hours of use.,,,,https://www.keelerglobal.com/wp-content/uploads/2024/02/1919-P-1013-7-jpg.webp,active,false
1919-p-5215,keeler,surgery-instruments,Batterie Au Lithium avec Rheostat,Lithium Battery with Rheostat,Alimentation your indirect avec easeLithium batterie avec rheostat pour use avec le Spectra iris binoculaire indirect et le Loupe K-éclairage LED système.Features:batterie charges in two hours avec a usable charge in five minutes.léger design weighing only six ounces (171 grams).Illumination strength can be controlled by adjusting le dimmer control knob on le bloc-batterie.a belt clip located on le back de le batterie pour easy transportation.Charging base is not included et must be purchased separately.,Power your indirect with easeLithium battery with rheostat for use with the Spectra Iris binocular indirect and the Loupe K-LED light system.Features:Battery charges in two hours with a usable charge in five minutes.Lightweight design weighing only six ounces (171 grams).Illumination strength can be controlled by adjusting the dimmer control knob on the battery pack.A belt clip located on the back of the battery for easy transportation.Charging base is not included and must be purchased separately.,,,,https://www.keelerglobal.com/wp-content/uploads/2024/02/1919-p-5215-7-jpg.webp,active,false
1941-P-1341,keeler,surgery-instruments,Mini Lithium Chargeur,Mini Lithium Charger,Small et compactThe,Small and compactThe,,,,https://www.keelerglobal.com/wp-content/uploads/2024/02/1941-P-1341-10.webp,active,false
1941-P-1368,keeler,surgery-instruments,Lithium Double Chargeur,Lithium Double Charger,Un compact chargeur that takes 2 x handlesThis chargeur fits neatly into your immediate testing environment allowing easy access to your hand held instruments.Features:the chargeur can be table top ou wall mounted.Speed charge in only 2 hours LED display pour instant indication.Provides over 2 hours continuous use.,A compact charger that takes 2 x handlesThis charger fits neatly into your immediate testing environment allowing easy access to your hand held instruments.Features:The charger can be table top or wall mounted.Speed charge in only 2 hours LED display for instant indication.Provides over 2 hours continuous use.,,,,https://www.keelerglobal.com/wp-content/uploads/2024/02/lithiumdoublebattery4.png,active,false
1941-p-5385,keeler,surgery-instruments,Lithium Chargeur et Alimentation Électrique,Lithium Charger and Power Supply,Charge your indirect equipment avec easeA Lithium charging dock et alimentation électrique pour use avec le Spectra iris binoculaire indirect et le Loupe K-éclairage LED système.Features:batterie charges in two hours avec a usable charge in five minutes.Illumination strength can be controlled by adjusting le dimmer control knob on le bloc-batterie.bloc-batterie is not included et must be purchased separately.,Charge your indirect equipment with easeA Lithium charging dock and power supply for use with the Spectra Iris binocular indirect and the Loupe K-LED light system.Features:Battery charges in two hours with a usable charge in five minutes.Illumination strength can be controlled by adjusting the dimmer control knob on the battery pack.Battery pack is not included and must be purchased separately.,,,,https://www.keelerglobal.com/wp-content/uploads/2024/02/1941-p-5385-7-jpg.webp,active,false
1964-P-2000,keeler,surgery-instruments,"Dispos-un-spec Wall Dispenser avec 25x 2.5mm, 3.5mm, 4.5mm, 5.5mm Specula","Dispos-a-spec Wall Dispenser with 25x 2.5mm, 3.5mm, 4.5mm, 5.5mm Specula",Spéculum dispenserAdd to your new Keeler wall unité ou simply display it next to your old Keeler wall unité.Features:Lid can be easily removed to insert new specula.,Speculum dispenserAdd to your new Keeler wall unit or simply display it next to your old Keeler wall unit.Features:Lid can be easily removed to insert new specula.,,,,https://www.keelerglobal.com/wp-content/uploads/2024/02/1964-P-2000-10.webp,active,false
1964-P-2003,keeler,surgery-instruments,Standard Ophtalmoscope/standard Otoscope Corded Unité Ensemble 240V,Standard Ophthalmoscope/standard Otoscope Corded Unit Set 240V,Industry leading standard ophtalmoscope et otoscope pour ward et GP useKeeler’s anti-theft design ophthalmoscopes et otoscopes have a lockable tête et manche fitting so you’ll always find them where you left them. le cord outfit consists de,Industry leading standard ophthalmoscope and otoscope for ward and GP useKeeler’s anti-theft design ophthalmoscopes and otoscopes have a lockable head and handle fitting so you’ll always find them where you left them. The cord outfit consists of,,,,https://www.keelerglobal.com/wp-content/uploads/2024/02/1964-P-2003-10.webp,active,false
1964-P-2015,keeler,ophthalmology-surgical,Practitioner Ophtalmoscope/practitioner Otoscope Corded Unité Ensemble 240V,Practitioner Ophthalmoscope/practitioner Otoscope Corded Unit Set 240V,New pour 2024: a,New for 2024: a,,,,https://www.keelerglobal.com/wp-content/uploads/2024/02/Featuring-LED-illumination-8.png,active,false
1964-P-2016,keeler,ophthalmology-surgical,Practitioner Ophtalmoscope/fibre Optique Otoscope Corded Unité Ensemble 240V,Practitioner Ophthalmoscope/fibre Optic Otoscope Corded Unit Set 240V,New pour 2024: a,New for 2024: a,,,,https://www.keelerglobal.com/wp-content/uploads/2024/02/cordedunitset.png,active,false
2004-P-1012,keeler,surgery-instruments,K-Led II Portable Simple Chargeur Lumière Système Keeler-fit in Mallette de Transport,K-Led II Portable Single Charger Light System Keeler-fit in Carry Case,Keeler K-LED gives 34000 lux de homogeneous white lumière et is fully portable.the 3W LED is mounted coaxially on le loupe* bar et is powered by a batterie au lithium pack giving 7 hours continuous use.the K-LED portable comes avec one bloc-batterie et a mallette de transport to protect your loupes et headlight when not in use. It can be retrofitted to all Keeler loupes. Available in either a standard Keeler loupe fitting ou a universal loupe fitting.Optimum distance de travail pour le K-LED is between 340 – 500mmFeatures:LED technology 34000 luxYellow FilterRetrofit to all Keeler LoupesPortableRechargeable batterie au lithium PackWhite lumière.,Keeler K-LED gives 34000 lux of homogeneous white light and is fully portable.The 3W LED is mounted coaxially on the loupe* bar and is powered by a lithium battery pack giving 7 hours continuous use.The K-LED Portable comes with one battery pack and a carrying case to protect your loupes and headlight when not in use. It can be retrofitted to all Keeler loupes. Available in either a standard Keeler loupe fitting or a universal loupe fitting.Optimum working distance for the K-LED is between 340 – 500mmFeatures:LED technology 34000 luxYellow FilterRetrofit to all Keeler LoupesPortableRechargeable Lithium Battery PackWhite Light.,,,,https://www.keelerglobal.com/wp-content/uploads/2024/04/KLED-charger.png,active,false
2004-P-1012 / 2004-P-1007,keeler,surgery-instruments,Sistema de Iluminación K-Led II,Sistema of Iluminación K-Led II,Totalmente portátil con 34000 lux de luz blanca homogéneaEl LED de 3 W está montado coaxialmente en la barra de la lupa* y funciona con una batería de litio que proporciona 7 horas de uso continuo. El K-LED se suministra con uno o dos paquetes de baterías y una unidad de carga simple o doble que puede alojar y cargar ambos paquetes simultáneamente. También puede utilizarse como práctico contenedor para guardar las lupas cuando no se utilizan. Se puede adaptar a todas las lupas Keeler. Disponible en a accesorio de lupa Keeler estándar o en a accesorio de lupa universal. La distancia de trabajo óptima para el K-LED es de 340 a 500 mm*Las lupas y las monturas deben adquirirse por separadoCaracterísticas:Tecnología LED,Totalmente portátil con 34000 lux of luz blanca homogéneaEl LED of 3 W está montado coaxialmente en la barra of la lupa* y funciona con una batería of litio que proporciona 7 horas of uso continuo. El K-LED se suministra con uno o dos paquetes of baterías y una unidad of carga simple o doble que puede alojar y cargar ambos paquetes simultáneamente. También puede utilizarse como práctico contenedor para guardar las lupas cuando no se utilizan. Se puede adaptar a todas las lupas Keeler. Disponible en a accesorio of lupa Keeler estándar o en a accesorio of lupa universal. La distancia of trabajo óptima para el K-LED es of 340 a 500 mm*Las lupas y las monturas deben adquirirse por separadoCaracterísticas:Tecnología LED,,,,https://www.keelerglobal.com/wp-content/uploads/2024/02/K-LED-II-desk-charger-black-edited-LR.png,active,false
2025-03,keeler,ophthalmology-diagnostic,Sonda de Ultrasonidos Un-scan Compatible Con la Plataforma 4sight,Sonda of Ultrasonidos A-scan Compatible Con la Plataforma 4sight,"Imágenes de alta calidad y mediciones biométricas precisas bajo demandaEsta unidad contiene todo lo que necesita para ponerse en marcha con Keeler 4Sight™, nuestra solución de ultrasonidos todo en uno.La cirugía de cataratas más exigente requiere a equipo potente y el a-Scan es la solución más eficaz para","Imágenes of alta calidad y mediciones biométricas precisas bajo demandaEsta unidad contiene todo lo que necesita para ponerse en marcha con Keeler 4Sight™, nuestra solución of ultrasonidos todo en uno.La cirugía of cataratas más exigente requiere a equipo potente y el A-Scan es la solución más eficaz para",,,,https://www.keelerglobal.com/wp-content/uploads/2024/03/24-8000A-3-jpg.webp,active,false
2105-K-1159,keeler,surgery-instruments,Volk 20D Cristallin – V20Lc,Volk 20D Lens – V20Lc,Delivering le best rétinien image from a 20 diopter lensVolk’s 20D delivers le best rétinien image de any 20 diopter cristallin on le market.Volk’s state-of-the-art 20D diagnostic/laser cristallin is perfectly corrected pour field,Delivering the best retinal image from a 20 diopter lensVolk’s 20D delivers the best retinal image of any 20 diopter lens on the market.Volk’s state-of-the-art 20D diagnostic/laser lens is perfectly corrected for field,,,,https://www.keelerglobal.com/wp-content/uploads/2024/02/2105-K-1159.webp,active,false
2105-L-1103,keeler,ophthalmology-surgical,Volk 90D Cristallin – V90C,Volk 90D Lens – V90C,Start le lampe à fente examen revolution!the original Volk 90D cristallin features a small 26mm diamètre anneau design which is outstanding pour dynamic fundoscopy.h2>Features:double Aspheric optical design which expands le usable viewing field beyond that de competitive designs.,Start the slit lamp examination revolution!The original Volk 90D lens features a small 26mm diameter ring design which is outstanding for dynamic fundoscopy.h2>Features:Double Aspheric optical design which expands the usable viewing field beyond that of competitive designs.,,,,https://www.keelerglobal.com/wp-content/uploads/2024/02/2105-L-1103-7-jpg.webp,active,false
2105-L-1218,keeler,surgery-instruments,Volk 15D Cristallin – V15Lc,Volk 15D Lens – V15Lc,High grossissement avec a optimised distance de travail from le corneaVolk’s 15D provides high grossissement along avec a optimized distance de travail from le cornée.avec its 4.11x grossissement it is also well suited pour disc et macular observation.h2>Features:36/47 degré champ de vision.24x laser spot.4.11x image mag.72mm distance de travail.,High magnification with an optimised working distance from the corneaVolk’s 15D provides high magnification along with an optimized working distance from the cornea.With its 4.11x magnification it is also well suited for disc and macular observation.h2>Features:36/47 degree field of view.24x laser spot.4.11x image mag.72mm working distance.,,,,https://www.keelerglobal.com/wp-content/uploads/2024/02/2105-L-1218-7-jpg.webp,active,false
2105-L-1234,keeler,ophthalmology-surgical,Volk 40D Cristallin – V40Lc,Volk 40D Lens – V40Lc,Ideal pour examinations requiring expansive fundus visibilityThe Volk 40D cristallin may be used at le lampe à fente biomicroscope to provide a extremely high grossissement view de le disc et macula. It is also perfect pour pediatric ophthalmoscopy et other examinations requiring expansive fundus visibility.h2>Features:69/90 degré champ de vision.6x laser spot.1.67x image mag.20mm distance de travail.,Ideal for examinations requiring expansive fundus visibilityThe Volk 40D lens may be used at the slit lamp biomicroscope to provide an extremely high magnification view of the disc and macula. It is also perfect for pediatric ophthalmoscopy and other examinations requiring expansive fundus visibility.h2>Features:69/90 degree field of view.6x laser spot.1.67x image mag.20mm working distance.,,,,https://www.keelerglobal.com/wp-content/uploads/2024/02/2105-L-1234-7-jpg.webp,active,false
2105-L-1240,keeler,surgery-instruments,Volk Numérique Clearfield Cristallin – Vdgtlcf,Volk Digital Clearfield Lens – Vdgtlcf,Le perfect cristallin pour mid et far peripheral rétinien viewingWith advanced glass technology et,The perfect lens for mid and far peripheral retinal viewingWith advanced glass technology and,,,,https://www.keelerglobal.com/wp-content/uploads/2024/02/2105-L-1240-7-jpg.webp,active,false
2105-L-1250,keeler,surgery-instruments,Volk 30D Cristallin – V30Sc,Volk 30D Lens – V30Sc,Excellent pour use avec small pupilsThe Volk 30D is designed to provide le practitioner a wide champ de vision avec a short distance de travail.h2>Features:58/75 degré champ de vision.47x laser spot.2.15x image mag.30mm distance de travail.,Excellent for use with small pupilsThe Volk 30D is designed to provide the practitioner a wide field of view with a short working distance.h2>Features:58/75 degree field of view.47x laser spot.2.15x image mag.30mm working distance.,,,,https://www.keelerglobal.com/wp-content/uploads/2024/02/2105-L-1250-7-jpg.webp,active,false
2105-L-1517,keeler,ophthalmology-surgical,Volk Super Pupille Cristallin – Vspxl,Volk Super Pupil Lens – Vspxl,Over a 100 degré field visible in a simple view!the SuperPupil XL provides le widest pan equatorial fundus view de any non-lentille de contact available. le XL’s wide field/high résolution optics allow detailed inspection de le postérieur pole as well as peripheral lesions including retinoschisis et rétinien detachments.h2>Features:Advanced optical design permits a 25mm diamètre field area through a undilated,Over a 100 degree field visible in a single view!The SuperPupil XL provides the widest pan equatorial fundus view of any non-contact lens available. The XL’s wide field/high resolution optics allow detailed inspection of the posterior pole as well as peripheral lesions including retinoschisis and retinal detachments.h2>Features:Advanced optical design permits a 25mm diameter field area through an undilated,,,,https://www.keelerglobal.com/wp-content/uploads/2024/02/2105-L-1517-7-jpg.webp,active,false
2105-L-1525,keeler,ophthalmology-surgical,Volk Superquad 160 Cristallin – Vsquad160,Volk Superquad 160 Lens – Vsquad160,Le ultimate PRP cristallin!Volk’s SuperQuad 160 still offers le widest champ de vision de any cristallin ever produced. Its ideal .5x image grossissement provides simultaneous visualisation de le postérieur pole to le peripheral ré,The ultimate PRP lens!Volk’s SuperQuad 160 still offers the widest field of view of any lens ever produced. Its ideal .5x image magnification provides simultaneous visualisation of the posterior pole to the peripheral,,,,https://www.keelerglobal.com/wp-content/uploads/2024/02/2105-L-1525-jpg.webp,active,false
2105-L-1541,keeler,ophthalmology-surgical,Volk Super Vitreofundus Cristallin – Vsvf,Volk Super Vitreofundus Lens – Vsvf,Ideally suited as your primary care rétinien scanning lensVolk’s Super VitreoFundus provides ultra wide-field viewing et outstanding small pupille ability pour quick et comprehensive fundus exams at le lampe à fente. It has been specifically designed to provide a wide champ de vision through small pupils sans le hassle et steep learning curve de typical small pupille lenses.h2>Features:Delivers a incredible 103/124 degré dynamic champ de vision.Ample .57x grossissement.Volk exclusive HI/LD glass ensures high résolution images – even avec lampe à fente settings de 25x et above.1.75x laser spot.4-5mm distance de travail.,Ideally suited as your primary care retinal scanning lensVolk’s Super VitreoFundus provides ultra wide-field viewing and outstanding small pupil ability for quick and comprehensive fundus exams at the Slit Lamp. It has been specifically designed to provide a wide field of view through small pupils without the hassle and steep learning curve of typical small pupil lenses.h2>Features:Delivers an incredible 103/124 degree dynamic field of view.Ample .57x magnification.Volk exclusive HI/LD glass ensures high resolution images – even with slit lamp settings of 25x and above.1.75x laser spot.4-5mm working distance.,,,,https://www.keelerglobal.com/wp-content/uploads/2024/02/2105-L-1541-7-jpg.webp,active,false
2105-L-1568,keeler,surgery-instruments,Volk 28D Cristallin – V28Lc,Volk 28D Lens – V28Lc,Excellent pour small pupille diagnostic et treatmentVolk’s 28D delivers a excellent rétinien image et provides exceptional résolution et fundus scanning capability.h2>Features:53/69 degré champ de vision.44x laser spot.2.27x image mag.33mm distance de travail.,Excellent for small pupil diagnosis and treatmentVolk’s 28D delivers an excellent retinal image and provides exceptional resolution and fundus scanning capability.h2>Features:53/69 degree field of view.44x laser spot.2.27x image mag.33mm working distance.,,,,https://www.keelerglobal.com/wp-content/uploads/2024/02/2105-L-1568-7-jpg.webp,active,false
2105-L-1592,keeler,surgery-instruments,Volk Capsulotomy Cristallin – Vcaps,Volk Capsulotomy Lens – Vcaps,Pour laser capsulotomy proceduresLaser capsulotomy procedures are now greatly improved avec Volk’s exclusive double Aspheric Capsulotomy laser cristallin.This new cristallin promotes precise et focused laser beam placement at le capsular bag. Computer optimised pour enhanced viewing et laser traitement de le postérieur capsule. This new aspheric design comes standard avec LaserWindow pour optimal laser beam transmission et imaging element protection.h2>Features:the preferred cristallin pour laser capsulotomy.63x laser spot.1.57x image mag.lentille de contact.,For laser capsulotomy proceduresLaser capsulotomy procedures are now greatly improved with Volk’s exclusive Double Aspheric Capsulotomy Laser Lens.This new lens promotes precise and focused laser beam placement at the capsular bag. Computer optimised for enhanced viewing and laser treatment of the posterior capsule. This new aspheric design comes standard with LaserWindow for optimal laser beam transmission and imaging element protection.h2>Features:The preferred lens for laser capsulotomy.63x laser spot.1.57x image mag.Contact lens.,,,,https://www.keelerglobal.com/wp-content/uploads/2024/02/2105-L-1592-7-jpg.webp,active,false
2105-L-1605,keeler,surgery-instruments,Volk Iridectomy Cristallin – Virid,Volk Iridectomy Lens – Virid,Un standard style cristallin pour iridectomy proceduresThe Volk Iridectomy cristallin featires a 8mm imaging ampoule that delivers le view you’re used to but avec le added benefit de Volk’s exclusive double Aspheric design et LaserWindow pour supérieur laser transmission & imaging element protection.h2>Features:double Aspherical optics pour supérieur high grossissement.LaserWindow pour optimal laser beam transmission et imaging protection.58x laser spot.1.7x image magContact cristallin.,A standard style lens for iridectomy proceduresThe Volk Iridectomy lens featires an 8mm imaging bulb that delivers the view you’re used to but with the added benefit of Volk’s exclusive Double Aspheric design and LaserWindow for superior laser transmission & imaging element protection.h2>Features:Double Aspherical optics for superior high magnification.LaserWindow for optimal laser beam transmission and imaging protection.58x laser spot.1.7x image magContact lens.,,,,https://www.keelerglobal.com/wp-content/uploads/2024/02/2105-L-1605-7-jpg.webp,active,false
2105-L-1656,keeler,surgery-instruments,Volk G3 – Goniofundus Cristallin – VG3,Volk G3 – Goniofundus Lens – VG3,Ideal pour examinations de le chambre anté,Ideal for examinations of the anterior,,,,https://www.keelerglobal.com/wp-content/uploads/2024/02/2105-L-1656-7-jpg.webp,active,false
2105-L-1664,keeler,surgery-instruments,Volk G4 – Goniolaser Cristallin-vg4,Volk G4 – Goniolaser Lens-vg4,Full 360° views de le chambre antérieure,Full 360° views of the anterior chamber,,,,https://www.keelerglobal.com/wp-content/uploads/2024/02/2105-L-1664-7-jpg.webp,active,false
2105-L-1728,keeler,surgery-instruments,Volk Centralis Direct Cristallin – VCD,Volk Centralis Direct Lens – VCD,View a direct upright image de le segment postérieur de le eyeVolk’s Centralis Direct laser cristallin affords le practitioner a direct upright image de le segment postérieur de le eye. Utilising a unique solid methyl methacrylate optic avec a bonded protective glass LaserWindow™,View a direct upright image of the posterior segment of the eyeVolk’s Centralis Direct Laser Lens affords the practitioner a direct upright image of the posterior segment of the eye. Utilising a unique solid methyl methacrylate optic with a bonded protective glass LaserWindow™,,,,https://www.keelerglobal.com/wp-content/uploads/2024/02/2105-L-1728-7-jpg.webp,active,false
2105-L-1736,keeler,surgery-instruments,Volk Fundus Laser Cristallin – Vfundus,Volk Fundus Laser Lens – Vfundus,Improved performance over existing fundus lensesThis is a advanced fundus laser cristallin design avec Volk exclusive double Aspherical optics pour supérieur high grossissement viewing et traitement de le nerf optique tête et macula. State de le art computer designed aspheric optics provide improved performance over existing fundus cristallin designs. le Volk Fundus cristallin comes standard avec LaserWindow pour optimal laser beam transmission et imaging element protection. This unique feature also creates a closed système – protecting le imaging element from,Improved performance over existing fundus lensesThis is an advanced fundus laser lens design with Volk exclusive Double Aspherical optics for superior high magnification viewing and treatment of the optic nerve head and macula. State of the art computer designed aspheric optics provide improved performance over existing fundus lens designs. The Volk Fundus Lens comes standard with LaserWindow for optimal laser beam transmission and imaging element protection. This unique feature also creates a closed system – protecting the imaging element from,,,,https://www.keelerglobal.com/wp-content/uploads/2024/02/2105-L-1736-7-jpg.webp,active,false
2105-L-1744,keeler,surgery-instruments,Volk Blumenthal Suturelysis Cristallin – Vbsl,Volk Blumenthal Suturelysis Lens – Vbsl,Unprecedented visibility de trabéculectomie flap suturesThe Volk Blumenthal Suturelysis cristallin provides high-quality visibility de trabéculectomie flap,Unprecedented visibility of trabeculectomy flap suturesThe Volk Blumenthal Suturelysis lens provides high-quality visibility of trabeculectomy flap,,,,https://www.keelerglobal.com/wp-content/uploads/2024/02/2105-L-1744-7-jpg.webp,active,false
