referenceFournisseur,constructeur,slug,categoryId,status,isFeatured,nom_fr,nom_en,description_fr,description_en,ficheTechnique_fr,ficheTechnique_en,imageUrl,secondaryImageUrl1,secondaryImageUrl2,secondaryImageUrl3,pdfBrochureUrl
20221X1,MORIA,composites-23g-capsulorhexis-forceps-long-1-5-mm-i,ophthalmology-surgical,active,,"Composites 23G Capsulorhexis pinces – Long(1.5-mm incision, 23G)","Composites 23G Capsulorhexis Forceps – Long(1.5-mm incision, 23G)",23Gdistal-commandréutilisablecapsulorhexis forcepswithcurved active partand ≈90°pointed pointe to produce rhexis of the anterior capsular bag through a 1.5-mm incision.,23Gdistal-commandreusablecapsulorhexis forcepswithcurved active partand ≈90°pointed tip to produce rhexis of the anterior capsular bag through a 1.5-mm incision.,"Reusability: Yes; Packaging: X1; Material*Active part: stainless steelHandle : composite; SizeTotal length: 136 mm; Tip: 0.3-mm teeth size, Pointed, ≈ 90°; Other characteristics: distal, laser graduation; Instrument base shape: Rounded handle; Intended use: Intended to perform the rhexis of the capsular bag through a 1.5-mm incision","Reusability: Yes; Packaging: X1; Material*Active part: stainless steelHandle : composite; SizeTotal length: 136 mm; Tip: 0.3-mm teeth size, Pointed, ≈ 90°; Other characteristics: distal, laser graduation; Instrument base shape: Rounded handle; Intended use: Intended to perform the rhexis of the capsular bag through a 1.5-mm incision",https://www.moria-surgical.com/media/cache/product_viewer/files/product/c702d1ce60fbedd46f622d4652e03d73dade38e0.jpg,,,,
20221X1,MORIA,composites-23g-capsulorhexis-forceps-long-1-5-mm-i,ophthalmology-surgical,active,,"Composites 23G Capsulorhexis pinces – Long(1.5-mm incision, 23G)","Composites 23G Capsulorhexis Forceps – Long(1.5-mm incision, 23G)",23Gdistal-commandréutilisablecapsulorhexis forcepswithcurved active partand ≈90°pointed pointe to produce rhexis of the anterior capsular bag through a 1.5-mm incision.,23Gdistal-commandreusablecapsulorhexis forcepswithcurved active partand ≈90°pointed tip to produce rhexis of the anterior capsular bag through a 1.5-mm incision.,"Reusability: Yes; Packaging: X1; Material*Active part: stainless steelHandle : composite; SizeTotal length: 136 mm; Tip: 0.3-mm teeth size, Pointed, ≈ 90°; Other characteristics: distal, laser graduation; Instrument base shape: Rounded handle; Intended use: Intended to perform the rhexis of the capsular bag through a 1.5-mm incision","Reusability: Yes; Packaging: X1; Material*Active part: stainless steelHandle : composite; SizeTotal length: 136 mm; Tip: 0.3-mm teeth size, Pointed, ≈ 90°; Other characteristics: distal, laser graduation; Instrument base shape: Rounded handle; Intended use: Intended to perform the rhexis of the capsular bag through a 1.5-mm incision",https://www.moria-surgical.com/media/cache/product_viewer/files/product/c702d1ce60fbedd46f622d4652e03d73dade38e0.jpg,,,,
20221X1,MORIA,composites-23g-capsulorhexis-forceps-long-1-5-mm-i,ophthalmology-surgical,active,,"Composites 23G Capsulorhexis pinces – Long(1.5-mm incision, 23G)","Composites 23G Capsulorhexis Forceps – Long(1.5-mm incision, 23G)",23Gdistal-commandréutilisablecapsulorhexis forcepswithcurved active partand ≈90°pointed pointe to produce rhexis of the anterior capsular bag through a 1.5-mm incision.,23Gdistal-commandreusablecapsulorhexis forcepswithcurved active partand ≈90°pointed tip to produce rhexis of the anterior capsular bag through a 1.5-mm incision.,"Reusability: Yes; Packaging: X1; Material*Active part: stainless steelHandle : composite; SizeTotal length: 136 mm; Tip: 0.3-mm teeth size, Pointed, ≈ 90°; Other characteristics: distal, laser graduation; Instrument base shape: Rounded handle; Intended use: Intended to perform the rhexis of the capsular bag through a 1.5-mm incision","Reusability: Yes; Packaging: X1; Material*Active part: stainless steelHandle : composite; SizeTotal length: 136 mm; Tip: 0.3-mm teeth size, Pointed, ≈ 90°; Other characteristics: distal, laser graduation; Instrument base shape: Rounded handle; Intended use: Intended to perform the rhexis of the capsular bag through a 1.5-mm incision",https://www.moria-surgical.com/media/cache/product_viewer/files/product/c702d1ce60fbedd46f622d4652e03d73dade38e0.jpg,,,,
20221X1,MORIA,composites-23g-capsulorhexis-forceps-long-1-5-mm-i,ophthalmology-surgical,active,,"Composites 23G Capsulorhexis pinces – Long(1.5-mm incision, 23G)","Composites 23G Capsulorhexis Forceps – Long(1.5-mm incision, 23G)",23Gdistal-commandréutilisablecapsulorhexis forcepswithcurved active partand ≈90°pointed pointe to produce rhexis of the anterior capsular bag through a 1.5-mm incision.,23Gdistal-commandreusablecapsulorhexis forcepswithcurved active partand ≈90°pointed tip to produce rhexis of the anterior capsular bag through a 1.5-mm incision.,"Reusability: Yes; Packaging: X1; Material*Active part: stainless steelHandle : composite; SizeTotal length: 136 mm; Tip: 0.3-mm teeth size, Pointed, ≈ 90°; Other characteristics: distal, laser graduation; Instrument base shape: Rounded handle; Intended use: Intended to perform the rhexis of the capsular bag through a 1.5-mm incision","Reusability: Yes; Packaging: X1; Material*Active part: stainless steelHandle : composite; SizeTotal length: 136 mm; Tip: 0.3-mm teeth size, Pointed, ≈ 90°; Other characteristics: distal, laser graduation; Instrument base shape: Rounded handle; Intended use: Intended to perform the rhexis of the capsular bag through a 1.5-mm incision",https://www.moria-surgical.com/media/cache/product_viewer/files/product/c702d1ce60fbedd46f622d4652e03d73dade38e0.jpg,,,,
19018,MORIA,double-armed-cannula-for-lasik-19018,ophthalmology-surgical,active,,Double-Armed Cannula(for LASIK),Double-Armed Cannula(for LASIK),"Double-armedcannulalike a tuning fork with 4 irrigation ports on each arm for irrigation duringLASIKsurgery.Angulated, with a straight active part.External diameter: 0.5 mm (25G).","Double-armedcannulalike a tuning fork with 4 irrigation ports on each arm for irrigation duringLASIKsurgery.Angulated, with a straight active part.External diameter: 0.5 mm (25G).","Reusability: Yes; Packaging: X1; Material*: Stainless steel; Length: 3 mm; TipDouble-armed, straight and angulated tip4 irrigation ports on each armExternal diameter: 0.5 mm (25G); Intended use: To irrigate during LASIK surgery.","Reusability: Yes; Packaging: X1; Material*: Stainless steel; Length: 3 mm; TipDouble-armed, straight and angulated tip4 irrigation ports on each armExternal diameter: 0.5 mm (25G); Intended use: To irrigate during LASIK surgery.",https://www.moria-surgical.com/media/cache/product_viewer/files/product/97998cd719723af048bcb1837d07d5c49199072a.jpg,,,,
20031,MORIA,cross-action-capsulorhexis-forceps-1-8-mm-1-8-mm-i,ophthalmology-surgical,active,,"Cross-Action Capsulorhexis pinces - 1.8 mm(1.8-mm incision, cross-action)","Cross-Action Capsulorhexis Forceps - 1.8 mm(1.8-mm incision, cross-action)",Cross-action capsulorhexis forcepswithcurved active partand ≈45°pointed pointe to produce the rhexis of the anterior capsular bag through a1.8-mmincision.,Cross-action capsulorhexis forcepswithcurved active partand ≈45°pointed tip to produce the rhexis of the anterior capsular bag through a1.8-mmincision.,"Reusability: Yes; Packaging: X1; Material*: Stainless steel; SizeTotal length: 125 mm; Tip: Pointed, ≈45°; Other characteristics: Curved active part, cross-action; Instrument base shape: Bird-cage handle; Intended use: Intended to perform the rhexis of the capsular bag through a 1.8-mm incision","Reusability: Yes; Packaging: X1; Material*: Stainless steel; SizeTotal length: 125 mm; Tip: Pointed, ≈45°; Other characteristics: Curved active part, cross-action; Instrument base shape: Bird-cage handle; Intended use: Intended to perform the rhexis of the capsular bag through a 1.8-mm incision",https://www.moria-surgical.com/media/cache/product_viewer/files/product/9a5dbed0da9b4d9c7365491571a92976788148d4.jpg,,,,
20041,MORIA,pisacano-hook-vertical-disk-tip-20041,ophthalmology-surgical,active,,Pisacano Hook(vertical disk tip),Pisacano Hook(vertical disk tip),"11.6-cm length, angled active part length of 11.5 mm, with a blunt and rounded extremity.peut être utilisé pour manipulate theintraocular lensand/ornucleusduringcataractsurgery.","11.6-cm length, angled active part length of 11.5 mm, with a blunt and rounded extremity.Can be used to manipulate theintraocular lensand/ornucleusduringcataractsurgery.","Reusability: Yes; Packaging: X1; Material*: Stainless steel; Size: 116 mm; Tip: Blunt, angled, round, vertical disk; Instrument base shape: Knurled; Intended use: To manipulate the intraocular lens and/or nucleus during cataract surgery.","Reusability: Yes; Packaging: X1; Material*: Stainless steel; Size: 116 mm; Tip: Blunt, angled, round, vertical disk; Instrument base shape: Knurled; Intended use: To manipulate the intraocular lens and/or nucleus during cataract surgery.",https://www.moria-surgical.com/media/cache/product_viewer/files/product/1d7dd231127f3c5f114564d0ed41fe036def30f9.jpg,,,,
20000,MORIA,crozafon-forceps-1-8-mm-1-8-mm-incision-20000,ophthalmology-surgical,active,,Crozafon pinces - 1.8 mm(1.8-mm incision),Crozafon Forceps - 1.8 mm(1.8-mm incision),réutilisablecapsulorhexis forcepswithcurved active partand ≈45°pointed pointe to produce the rhexis of the anterior capsular bag through a1.8-mmincision.,Reusablecapsulorhexis forcepswithcurved active partand ≈45°pointed tip to produce the rhexis of the anterior capsular bag through a1.8-mmincision.,"Reusability: Yes; Packaging: X1; Material*: Stainless steel; SizeTotal length: 117 mm; Tip: Pointed, ≈45°; Other characteristics: Curved active part; Instrument base shape: Bird-cage handle; Intended use: Intended to perform the rhexis of the capsular bag through a 1.8-mm incision","Reusability: Yes; Packaging: X1; Material*: Stainless steel; SizeTotal length: 117 mm; Tip: Pointed, ≈45°; Other characteristics: Curved active part; Instrument base shape: Bird-cage handle; Intended use: Intended to perform the rhexis of the capsular bag through a 1.8-mm incision",https://www.moria-surgical.com/media/cache/product_viewer/files/product/0ba12bba2440b56729f6da0bcd95d36a4b41e686.jpg,,,,
1514-P-7108,KEELER,led-practitioner-otoscope-head-only-1514-p-7108,ophthalmology-surgical,active,,LED Practitioner Otoscope head only,LED Practitioner Otoscope head only,"The industry leader for hospital and Gen Med use, now with LED illuminationThe Keeler LED Practitioner Otoscope is the popular choice for hospitals and Gen Med customers.This product is only the head of the Otoscope (replacement for your existing manche), for the complete instrument see ourKeeler LED Practitioner Otoscopeproduct.Features:Practitioner Otoscope head with LED illumination module (brighter, whiter light and longer lasting battery vs traditional Halogen Bulb)Unobstructed open style h","The industry leader for hospital and Gen Med use, now with LED illuminationThe Keeler LED Practitioner Otoscope is the popular choice for hospitals and Gen Med customers.This product is only the head of the Otoscope (replacement for your existing handle), for the complete instrument see ourKeeler LED Practitioner Otoscopeproduct.Features:Practitioner Otoscope head with LED illumination module (brighter, whiter light and longer lasting battery vs traditional Halogen Bulb)Unobstructed open style h",Unobstructed open style: Unobstructed open style head for easy introduction of small instruments for wax or foreign body removal; Image Magnification: Large slide aside 2.5x lens for clear view of aural structures and procedures under magnification,Unobstructed open style: Unobstructed open style head for easy introduction of small instruments for wax or foreign body removal; Image Magnification: Large slide aside 2.5x lens for clear view of aural structures and procedures under magnification,https://www.keelerglobal.com/wp-content/uploads/2024/08/ledpractitionerotoscopeheadonly-3.png,https://www.keelerglobal.com/wp-content/uploads/2024/08/ledpractitionerotoscopeheadonly-3.png,,,
1514-P-7001,KEELER,vantage-plus-digital-bio-with-keeler-kinexis-softw,ophthalmology-surgical,active,,Vantage Plus Digital BIO (with Keeler Kinexis software),Vantage Plus Digital BIO (with Keeler Kinexis software),"Discover our new and improved digital BIOHigh-quality imaging is crucial for accurate documentation and teaching. The Vantage Plus Digital fits seamlessly into the existing workflow of ophthalmologists, allowing them to capture high-resolution images while using their binocular indirect ophthalmoscope. This integration simplifies the process, enhances documentation, and supports better patient care.Features:Unparalleled optics and visual performanceVisualise, capture and save images and videos f","Discover our new and improved digital BIOHigh-quality imaging is crucial for accurate documentation and teaching. The Vantage Plus Digital fits seamlessly into the existing workflow of ophthalmologists, allowing them to capture high-resolution images while using their binocular indirect ophthalmoscope. This integration simplifies the process, enhances documentation, and supports better patient care.Features:Unparalleled optics and visual performanceVisualise, capture and save images and videos f","Image Magnification: Exam room imaging; Kinexis software –: Kinexis software – extract still frames, generate detailed reports, and export data to DICOM; Kinexis software application,: Kinexis software application, software license and instruction manual USB; Instruction of binocular: Instruction of binocular indirect ophthalmoscopy exams; Recording exams performed: Recording exams performed with scleral indentation; Weight: 0.8 kg","Image Magnification: Exam room imaging; Kinexis software –: Kinexis software – extract still frames, generate detailed reports, and export data to DICOM; Kinexis software application,: Kinexis software application, software license and instruction manual USB; Instruction of binocular: Instruction of binocular indirect ophthalmoscopy exams; Recording exams performed: Recording exams performed with scleral indentation; Weight: 0.8 kg",https://www.keelerglobal.com/wp-content/uploads/2024/08/Untitled-design-1.png,https://www.keelerglobal.com/wp-content/uploads/2024/08/Untitled-design-1.png,,,
1013-P-7009,KEELER,all-pupil-2-led-upgrade-1013-p-7009,ophthalmology-surgical,active,,All Pupil 2 LED upgrade,All Pupil 2 LED upgrade,"Light, bright and easy to useThis LED upgrade plugs into the back of your All Pupil II to give you all the benefits of LED illumination.Features:LED cooler colour provides brighter, whiter illumination.Freedom from purchasing bulbsAn LED life expectancy up to 10,000 hours.Includes 5 years warranty. Helping our customers bring an end to preventable vision loss. Keeler LtdClewer Hill Road, Windsor, Berkshire SL4 4AA UKTel: +44 (0) 1753 857 177","Light, bright and easy to useThis LED upgrade plugs into the back of your All Pupil II to give you all the benefits of LED illumination.Features:LED cooler colour provides brighter, whiter illumination.Freedom from purchasing bulbsAn LED life expectancy up to 10,000 hours.Includes 5 years warranty. Helping our customers bring an end to preventable vision loss. Keeler LtdClewer Hill Road, Windsor, Berkshire SL4 4AA UKTel: +44 (0) 1753 857 177","An LED life: An LED life expectancy up to 10,000 hours.","An LED life: An LED life expectancy up to 10,000 hours.",https://www.keelerglobal.com/wp-content/uploads/2024/02/all-pupill-ii-a4-sheet-250-250-jpg.webp,https://www.keelerglobal.com/wp-content/uploads/2024/02/all-pupill-ii-a4-sheet-250-250-jpg.webp,,,
1513-P-1054,KEELER,pocket-otoscope-1513-p-1054,ophthalmology-surgical,active,,Pocket Otoscope,Pocket Otoscope,Portable and compact Pocket Otoscope for ward and GP useWith full diagnostic capacity in a compact instrument makes the Pocket Otoscope ideal for the Practitioner on the move. An ideal choice for domiciliary and ward use or as a backup instrument.Features:Closed head system ideally suited to pneumatic testing.2.5x removable magnifying lens allows the introduction of small instruments.Can be used with either permanent or disposable specula.Available with a 2.8V or 3.6V Bulb Illumination.Strong me,Portable and compact Pocket Otoscope for ward and GP useWith full diagnostic capacity in a compact instrument makes the Pocket Otoscope ideal for the Practitioner on the move. An ideal choice for domiciliary and ward use or as a backup instrument.Features:Closed head system ideally suited to pneumatic testing.2.5x removable magnifying lens allows the introduction of small instruments.Can be used with either permanent or disposable specula.Available with a 2.8V or 3.6V Bulb Illumination.Strong me,"Image Magnification: 2.5x removable magnifying lens allows the introduction of small instruments.; Pocket OtoscopeFive permanent Speculae are providedDiameters: 2.5mm, 3.5mm, 4.5mm, 5.5mm and 8mm.HandleSpare bulbInstructions CDProtective caseRechargeableLithium Battery (3.6V Models Only)Insufflator AdaptorBulb extractor toolTube of Disposable Speculae; Diameters: 2.5mm, 3.5mm, 4.5mm, 5.5mm and 8mm.; Bulb extractor tool: Bulb extractor tool","Image Magnification: 2.5x removable magnifying lens allows the introduction of small instruments.; Pocket OtoscopeFive permanent Speculae are providedDiameters: 2.5mm, 3.5mm, 4.5mm, 5.5mm and 8mm.HandleSpare bulbInstructions CDProtective caseRechargeableLithium Battery (3.6V Models Only)Insufflator AdaptorBulb extractor toolTube of Disposable Speculae; Diameters: 2.5mm, 3.5mm, 4.5mm, 5.5mm and 8mm.; Bulb extractor tool: Bulb extractor tool",https://www.keelerglobal.com/wp-content/uploads/2024/02/1517-P-1019.png,https://www.keelerglobal.com/wp-content/uploads/2024/02/1517-P-1019.png,,,
1013-P-7010,KEELER,all-pupil-2-led-upgrade-1013-p-7010,ophthalmology-surgical,active,,All Pupil 2 LED upgrade,All Pupil 2 LED upgrade,"Light, bright and easy to useThis LED upgrade plugs into the back of your All Pupil II to give you all the benefits of LED illumination.Features:LED cooler colour provides brighter, whiter illumination.Freedom from purchasing bulbsAn LED life expectancy up to 10,000 hours.Includes 5 years warranty. Helping our customers bring an end to preventable vision loss. Keeler LtdClewer Hill Road, Windsor, Berkshire SL4 4AA UKTel: +44 (0) 1753 857 177","Light, bright and easy to useThis LED upgrade plugs into the back of your All Pupil II to give you all the benefits of LED illumination.Features:LED cooler colour provides brighter, whiter illumination.Freedom from purchasing bulbsAn LED life expectancy up to 10,000 hours.Includes 5 years warranty. Helping our customers bring an end to preventable vision loss. Keeler LtdClewer Hill Road, Windsor, Berkshire SL4 4AA UKTel: +44 (0) 1753 857 177","An LED life: An LED life expectancy up to 10,000 hours.","An LED life: An LED life expectancy up to 10,000 hours.",https://www.keelerglobal.com/wp-content/uploads/2024/02/all-pupill-ii-a4-sheet-250-250-jpg.webp,https://www.keelerglobal.com/wp-content/uploads/2024/02/all-pupill-ii-a4-sheet-250-250-jpg.webp,,,
