referenceFournisseur,constructeur,slug,categoryId,status,isFeatured,nom_fr,nom_en,description_fr,description_en,ficheTechnique_fr,ficheTechnique_en,imageUrl,secondaryImageUrl1,secondaryImageUrl2,secondaryImageUrl3,pdfBrochureUrl
1132-P-1157,KEELER,oftalmoscopio-de-bolsillo-jazz-led-1132-p-1157,ophthalmology-surgical,active,,Oftalmoscopio de bolsillo JAZZ LED,Oftalmoscopio de bolsillo JAZZ LED,"Moderno oftalmoscopio de bolsillo personalizable para uso en salas y de los médicos generalesLa capacidad de diagnóstico completa en un instrumento compacto hace que el oftalmoscopio de bolsillo sea ideal para el profesional que se desplaza. Una opción ideal para uso domiciliario y en salas, o como instrumento de respaldo.Nuestro moderno oftalmoscopio Jazz se adaptará a cualquier entorno. Puede cambiar el color de su equipo añadiendo anillos de colores que se adapten a cualquier estado de ánimo.","Moderno oftalmoscopio de bolsillo personalizable para uso en salas y de los médicos generalesLa capacidad de diagnóstico completa en un instrumento compacto hace que el oftalmoscopio de bolsillo sea ideal para el profesional que se desplaza. Una opción ideal para uso domiciliario y en salas, o como instrumento de respaldo.Nuestro moderno oftalmoscopio Jazz se adaptará a cualquier entorno. Puede cambiar el color de su equipo añadiendo anillos de colores que se adapten a cualquier estado de ánimo.","La potencia de: La potencia de los lentes oscila entre +20D y -20D para un examen claro y sin esfuerzo de las estructuras oculares.; Filtro azul: se utiliza en combinación con la fluoresceína para evaluar los rasguños corneales.; Anillos de colores intercambiablesÓptica líder en su clase en cualquier lugarDiseñada para reducir el deslumbramiento del reflejo corneal y brindar imágenes nítidas, la óptica Keeler es reconocida en la industria por sus imágenes consistentes de alta calidad que le brindan confianza en sus evaluaciones.4 haces para una capacidad de diagnóstico completaGran angular: ilumina la mayor superficie del fondo de ojo para obtener el mejor diagnóstico general posible a través de una pupila dilatada.Macular: diseñado específicamente para el examen de la región macular del fondo de ojo, donde un haz más grande crearía una reacción pupilar excesiva o molestias al paciente.Semicírculo: proporciona una combinación de percepción de la profundidad y campo de visión.Cruz de fijación: proyecta una retícula sobre la retina para evaluar el grado y la dirección de la fijación excéntrica.Diseño delgado y ergonómicoDelgado y ligero, este oftalmoscopio compacto cabe perfectamente en el bolsillo.Lente de gran potenciaLas potencias de los lentes van de +20D a -20D.Anillos de colores intercambiablesAnillos de distintos colores para personalizarloFiltro de giro sobre verde, libre de rojoElija fácilmente el filtro que desee. Utilice el filtro libre de rojo para mejorar el examen de los vasos sanguíneos, especialmente útil para la evaluación y el seguimiento de la diabetes; Gran angular: ilumina la mayor superficie del fondo de ojo para obtener el mejor diagnóstico general posible a través de una pupila dilatada.; Macular: diseñado específicamente para el examen de la región macular del fondo de ojo, donde un haz más grande crearía una reacción pupilar excesiva o molestias al paciente.; Semicírculo: proporciona una combinación de percepción de la profundidad y campo de visión.; Cruz de fijación: proyecta una retícula sobre la retina para evaluar el grado y la dirección de la fijación excéntrica.Diseño delgado y ergonómicoDelgado y ligero, este oftalmoscopio compacto cabe perfectamente en el bolsillo.Lente de gran potenciaLas potencias de los lentes van de +20D a -20D.Anillos de colores intercambiablesAnillos de distintos colores para personalizarloFiltro de giro sobre verde, libre de rojoElija fácilmente el filtro que desee. Utilice el filtro libre de rojo para mejorar el examen de los vasos sanguíneos, especialmente útil para la evaluación y el seguimiento de la diabetes","La potencia de: La potencia de los lentes oscila entre +20D y -20D para un examen claro y sin esfuerzo de las estructuras oculares.; Filtro azul: se utiliza en combinación con la fluoresceína para evaluar los rasguños corneales.; Anillos de colores intercambiablesÓptica líder en su clase en cualquier lugarDiseñada para reducir el deslumbramiento del reflejo corneal y brindar imágenes nítidas, la óptica Keeler es reconocida en la industria por sus imágenes consistentes de alta calidad que le brindan confianza en sus evaluaciones.4 haces para una capacidad de diagnóstico completaGran angular: ilumina la mayor superficie del fondo de ojo para obtener el mejor diagnóstico general posible a través de una pupila dilatada.Macular: diseñado específicamente para el examen de la región macular del fondo de ojo, donde un haz más grande crearía una reacción pupilar excesiva o molestias al paciente.Semicírculo: proporciona una combinación de percepción de la profundidad y campo de visión.Cruz de fijación: proyecta una retícula sobre la retina para evaluar el grado y la dirección de la fijación excéntrica.Diseño delgado y ergonómicoDelgado y ligero, este oftalmoscopio compacto cabe perfectamente en el bolsillo.Lente de gran potenciaLas potencias de los lentes van de +20D a -20D.Anillos de colores intercambiablesAnillos de distintos colores para personalizarloFiltro de giro sobre verde, libre de rojoElija fácilmente el filtro que desee. Utilice el filtro libre de rojo para mejorar el examen de los vasos sanguíneos, especialmente útil para la evaluación y el seguimiento de la diabetes; Gran angular: ilumina la mayor superficie del fondo de ojo para obtener el mejor diagnóstico general posible a través de una pupila dilatada.; Macular: diseñado específicamente para el examen de la región macular del fondo de ojo, donde un haz más grande crearía una reacción pupilar excesiva o molestias al paciente.; Semicírculo: proporciona una combinación de percepción de la profundidad y campo de visión.; Cruz de fijación: proyecta una retícula sobre la retina para evaluar el grado y la dirección de la fijación excéntrica.Diseño delgado y ergonómicoDelgado y ligero, este oftalmoscopio compacto cabe perfectamente en el bolsillo.Lente de gran potenciaLas potencias de los lentes van de +20D a -20D.Anillos de colores intercambiablesAnillos de distintos colores para personalizarloFiltro de giro sobre verde, libre de rojoElija fácilmente el filtro que desee. Utilice el filtro libre de rojo para mejorar el examen de los vasos sanguíneos, especialmente útil para la evaluación y el seguimiento de la diabetes",https://www.keelerglobal.com/wp-content/uploads/2024/02/1102-P-1105-8-scaled.webp,https://www.keelerglobal.com/wp-content/uploads/2024/02/1102-P-1105-8-scaled.webp,,,
1128-P-1015,KEELER,pocket-ophthalmoscope-1128-p-1015,ophthalmology-surgical,active,,Pocket Ophthalmoscope,Pocket Ophthalmoscope,Portable and compact pocket ophthalmoscope for ward and GP useFull diagnostic capacity in a compact instrument make the Pocket ophthalmoscope ideal for the Practitioner on the move. An ideal choice for domiciliary and ward use or as a backup instrument.Features:Slimline design fits neatly in your pocket.Lens powers range from +20D to -20D for clear and effortless examination of ocular structures.Strong metal clip that can be attached to a pocket.Five diagnostic beams for full diagnostic capabili,Portable and compact pocket ophthalmoscope for ward and GP useFull diagnostic capacity in a compact instrument make the Pocket ophthalmoscope ideal for the Practitioner on the move. An ideal choice for domiciliary and ward use or as a backup instrument.Features:Slimline design fits neatly in your pocket.Lens powers range from +20D to -20D for clear and effortless examination of ocular structures.Strong metal clip that can be attached to a pocket.Five diagnostic beams for full diagnostic capabili,"Lens powers range: Lens powers range from +20D to -20D for clear and effortless examination of ocular structures.; Macular for a: Macular for a detailed examination of the central retina, reducing excessive pupillary reaction and patient discomfort; Intermediate – Permits: Intermediate – Permits easier access through and undilated pupil and in peripheral examination. Particularly useful in paediatric examination.; Red Free –: Red Free – The red free filter is used to examine blood vessels in fine detail. By filtering out the red light, blood vessels are silhouetted against a dark green background.; Fixation Cross –: Fixation Cross – Projects a graticule onto the retina for assessment of the degree and direction of eccentric fixation.","Lens powers range: Lens powers range from +20D to -20D for clear and effortless examination of ocular structures.; Macular for a: Macular for a detailed examination of the central retina, reducing excessive pupillary reaction and patient discomfort; Intermediate – Permits: Intermediate – Permits easier access through and undilated pupil and in peripheral examination. Particularly useful in paediatric examination.; Red Free –: Red Free – The red free filter is used to examine blood vessels in fine detail. By filtering out the red light, blood vessels are silhouetted against a dark green background.; Fixation Cross –: Fixation Cross – Projects a graticule onto the retina for assessment of the degree and direction of eccentric fixation.",https://www.keelerglobal.com/wp-content/uploads/2024/02/1102-P-1041-8-jpg.webp,https://www.keelerglobal.com/wp-content/uploads/2024/02/1102-P-1041-8-jpg.webp,,,
2113-P-2013,KEELER,sistema-prism-tico-supervu-xl-3-5x-2113-p-2013,ophthalmology-surgical,active,,Sistema prismático SuperVu XL 3.5x,Sistema prismático SuperVu XL 3.5x,"Aumento 3.5x para procedimientos quirúrgicos avanzadosLos sistemas de lupas quirúrgicas prismáticas Keeler SuperVu XL tienen un aumento de 3.5x y se suministran en un estuche de transporte blando e incluyen una montura deportiva, una palanca abatible esterilizable en autoclave y un paño de limpieza.Características:Mayor aumento para procedimientos quirúrgicos avanzados.La calidad prismática garantiza una imagen real.Claridad de borde a borde y reproducción precisa del color, ideal para aplicacio","Aumento 3.5x para procedimientos quirúrgicos avanzadosLos sistemas de lupas quirúrgicas prismáticas Keeler SuperVu XL tienen un aumento de 3.5x y se suministran en un estuche de transporte blando e incluyen una montura deportiva, una palanca abatible esterilizable en autoclave y un paño de limpieza.Características:Mayor aumento para procedimientos quirúrgicos avanzados.La calidad prismática garantiza una imagen real.Claridad de borde a borde y reproducción precisa del color, ideal para aplicacio",Image Magnification: Los lentes de precisión de la XL están tratados con una capa antirreflejo para producir una imagen óptima.; Sistema prismático SuperVu: Sistema prismático SuperVu XL 4.5x,Image Magnification: Los lentes de precisión de la XL están tratados con una capa antirreflejo para producir una imagen óptima.; Sistema prismático SuperVu: Sistema prismático SuperVu XL 4.5x,https://www.keelerglobal.com/wp-content/uploads/2024/02/prismatic-2.png,https://www.keelerglobal.com/wp-content/uploads/2024/02/prismatic-2.png,,,
1128-P-1014,KEELER,pocket-ophthalmoscope-1128-p-1014,ophthalmology-surgical,active,,Pocket Ophthalmoscope,Pocket Ophthalmoscope,Portable and compact pocket ophthalmoscope for ward and GP useFull diagnostic capacity in a compact instrument make the Pocket ophthalmoscope ideal for the Practitioner on the move. An ideal choice for domiciliary and ward use or as a backup instrument.Features:Slimline design fits neatly in your pocket.Lens powers range from +20D to -20D for clear and effortless examination of ocular structures.Strong metal clip that can be attached to a pocket.Five diagnostic beams for full diagnostic capabili,Portable and compact pocket ophthalmoscope for ward and GP useFull diagnostic capacity in a compact instrument make the Pocket ophthalmoscope ideal for the Practitioner on the move. An ideal choice for domiciliary and ward use or as a backup instrument.Features:Slimline design fits neatly in your pocket.Lens powers range from +20D to -20D for clear and effortless examination of ocular structures.Strong metal clip that can be attached to a pocket.Five diagnostic beams for full diagnostic capabili,"Lens powers range: Lens powers range from +20D to -20D for clear and effortless examination of ocular structures.; Macular for a: Macular for a detailed examination of the central retina, reducing excessive pupillary reaction and patient discomfort; Intermediate – Permits: Intermediate – Permits easier access through and undilated pupil and in peripheral examination. Particularly useful in paediatric examination.; Red Free –: Red Free – The red free filter is used to examine blood vessels in fine detail. By filtering out the red light, blood vessels are silhouetted against a dark green background.; Fixation Cross –: Fixation Cross – Projects a graticule onto the retina for assessment of the degree and direction of eccentric fixation.","Lens powers range: Lens powers range from +20D to -20D for clear and effortless examination of ocular structures.; Macular for a: Macular for a detailed examination of the central retina, reducing excessive pupillary reaction and patient discomfort; Intermediate – Permits: Intermediate – Permits easier access through and undilated pupil and in peripheral examination. Particularly useful in paediatric examination.; Red Free –: Red Free – The red free filter is used to examine blood vessels in fine detail. By filtering out the red light, blood vessels are silhouetted against a dark green background.; Fixation Cross –: Fixation Cross – Projects a graticule onto the retina for assessment of the degree and direction of eccentric fixation.",https://www.keelerglobal.com/wp-content/uploads/2024/02/1102-P-1041-8-jpg.webp,https://www.keelerglobal.com/wp-content/uploads/2024/02/1102-P-1041-8-jpg.webp,,,
1128-P-1013,KEELER,lithium-battery-for-wireless-vantage-plus-standard,ophthalmology-surgical,active,,Lithium battery for wireless Vantage Plus (Standard),Lithium battery for wireless Vantage Plus (Standard),"Power your indirect with easeLithium battery for use with the wireless Vantage PLus (standard).Features:Fits neatly into the charging unit.Original lithium battery lasts up to 11 hours of use. Helping our customers bring an end to preventable vision loss. Keeler LtdClewer Hill Road, Windsor, Berkshire SL4 4AA UKTel: +44 (0) 1753 857 177","Power your indirect with easeLithium battery for use with the wireless Vantage PLus (standard).Features:Fits neatly into the charging unit.Original lithium battery lasts up to 11 hours of use. Helping our customers bring an end to preventable vision loss. Keeler LtdClewer Hill Road, Windsor, Berkshire SL4 4AA UKTel: +44 (0) 1753 857 177",Image Magnification: Vantage Plus Hi Mag lens1202-P-7192,Image Magnification: Vantage Plus Hi Mag lens1202-P-7192,https://www.keelerglobal.com/wp-content/uploads/2024/02/1919-P-1013-7-jpg.webp,https://www.keelerglobal.com/wp-content/uploads/2024/02/1919-P-1013-7-jpg.webp,,,
1128-P-1008,KEELER,all-pupil-2-led-upgrade-1128-p-1008,ophthalmology-surgical,active,,All Pupil 2 LED upgrade,All Pupil 2 LED upgrade,"Light, bright and easy to useThis LED upgrade plugs into the back of your All Pupil II to give you all the benefits of LED illumination.Features:LED cooler colour provides brighter, whiter illumination.Freedom from purchasing bulbsAn LED life expectancy up to 10,000 hours.Includes 5 years warranty. Helping our customers bring an end to preventable vision loss. Keeler LtdClewer Hill Road, Windsor, Berkshire SL4 4AA UKTel: +44 (0) 1753 857 177","Light, bright and easy to useThis LED upgrade plugs into the back of your All Pupil II to give you all the benefits of LED illumination.Features:LED cooler colour provides brighter, whiter illumination.Freedom from purchasing bulbsAn LED life expectancy up to 10,000 hours.Includes 5 years warranty. Helping our customers bring an end to preventable vision loss. Keeler LtdClewer Hill Road, Windsor, Berkshire SL4 4AA UKTel: +44 (0) 1753 857 177","An LED life: An LED life expectancy up to 10,000 hours.","An LED life: An LED life expectancy up to 10,000 hours.",https://www.keelerglobal.com/wp-content/uploads/2024/02/all-pupill-ii-a4-sheet-250-250-jpg.webp,https://www.keelerglobal.com/wp-content/uploads/2024/02/all-pupill-ii-a4-sheet-250-250-jpg.webp,,,
1128-P-1004,KEELER,pocket-ophthalmoscope-1128-p-1004,ophthalmology-surgical,active,,Pocket Ophthalmoscope,Pocket Ophthalmoscope,Portable and compact pocket ophthalmoscope for ward and GP useFull diagnostic capacity in a compact instrument make the Pocket ophthalmoscope ideal for the Practitioner on the move. An ideal choice for domiciliary and ward use or as a backup instrument.Features:Slimline design fits neatly in your pocket.Lens powers range from +20D to -20D for clear and effortless examination of ocular structures.Strong metal clip that can be attached to a pocket.Five diagnostic beams for full diagnostic capabili,Portable and compact pocket ophthalmoscope for ward and GP useFull diagnostic capacity in a compact instrument make the Pocket ophthalmoscope ideal for the Practitioner on the move. An ideal choice for domiciliary and ward use or as a backup instrument.Features:Slimline design fits neatly in your pocket.Lens powers range from +20D to -20D for clear and effortless examination of ocular structures.Strong metal clip that can be attached to a pocket.Five diagnostic beams for full diagnostic capabili,"Lens powers range: Lens powers range from +20D to -20D for clear and effortless examination of ocular structures.; Macular for a: Macular for a detailed examination of the central retina, reducing excessive pupillary reaction and patient discomfort; Intermediate – Permits: Intermediate – Permits easier access through and undilated pupil and in peripheral examination. Particularly useful in paediatric examination.; Red Free –: Red Free – The red free filter is used to examine blood vessels in fine detail. By filtering out the red light, blood vessels are silhouetted against a dark green background.; Fixation Cross –: Fixation Cross – Projects a graticule onto the retina for assessment of the degree and direction of eccentric fixation.","Lens powers range: Lens powers range from +20D to -20D for clear and effortless examination of ocular structures.; Macular for a: Macular for a detailed examination of the central retina, reducing excessive pupillary reaction and patient discomfort; Intermediate – Permits: Intermediate – Permits easier access through and undilated pupil and in peripheral examination. Particularly useful in paediatric examination.; Red Free –: Red Free – The red free filter is used to examine blood vessels in fine detail. By filtering out the red light, blood vessels are silhouetted against a dark green background.; Fixation Cross –: Fixation Cross – Projects a graticule onto the retina for assessment of the degree and direction of eccentric fixation.",https://www.keelerglobal.com/wp-content/uploads/2024/02/1102-P-1041-8-jpg.webp,https://www.keelerglobal.com/wp-content/uploads/2024/02/1102-P-1041-8-jpg.webp,,,
2199-P-7531,KEELER,montura-deportiva-keeler-est-ndar-copy-2199-p-7531,ophthalmology-surgical,active,,Montura deportiva Keeler (estándar) (Copy),Montura deportiva Keeler (estándar) (Copy),Monturas de lupa modernas y cómodas en distintos coloresLa extraordinaria montura deportiva Keeler está disponible en varios colores brillantes y se adapta a todas las graduaciones. Todas las lupas quirúrgicas y dentales (Keeler) están disponibles en monturas nuevas.Características:La popular montura deportiva ligera de Keeler con pantalla protectora.Ultraportátil.Incluye 2 piezas nasales ajustables para mayor comodidad.Totalmente personalizadas: elija el color de las monturas que prefiera Ayuda,Monturas de lupa modernas y cómodas en distintos coloresLa extraordinaria montura deportiva Keeler está disponible en varios colores brillantes y se adapta a todas las graduaciones. Todas las lupas quirúrgicas y dentales (Keeler) están disponibles en monturas nuevas.Características:La popular montura deportiva ligera de Keeler con pantalla protectora.Ultraportátil.Incluye 2 piezas nasales ajustables para mayor comodidad.Totalmente personalizadas: elija el color de las monturas que prefiera Ayuda,Totalmente personalizadas: elija el color de las monturas que prefiera,Totalmente personalizadas: elija el color de las monturas que prefiera,https://www.keelerglobal.com/wp-content/uploads/2025/10/LOU-ST-2112-P-1002-to-1025-3.jpg,https://www.keelerglobal.com/wp-content/uploads/2025/10/LOU-ST-2112-P-1002-to-1025-3.jpg,,,
1128-P-1003,KEELER,led-practitioner-otoscope-1128-p-1003,ophthalmology-surgical,active,,LED Practitioner Otoscope,LED Practitioner Otoscope,"The industry leader for hospital and Gen Med use, now with LED illuminationThe Keeler LED Practitioner Otoscope is the popular choice for hospitals and Gen Med customers. The new LED Practitioner Otoscope (available as a full device or a head upgrade) offers a brighter and longer lasting battery vs. Keeler’s renowned halogen bulb.Features:Unobstructed open style head for easy introduction of small instruments for wax or foreign body removalLarge slide aside 2.5x lens for clear view of aural stru","The industry leader for hospital and Gen Med use, now with LED illuminationThe Keeler LED Practitioner Otoscope is the popular choice for hospitals and Gen Med customers. The new LED Practitioner Otoscope (available as a full device or a head upgrade) offers a brighter and longer lasting battery vs. Keeler’s renowned halogen bulb.Features:Unobstructed open style head for easy introduction of small instruments for wax or foreign body removalLarge slide aside 2.5x lens for clear view of aural stru","Unobstructed open style: Unobstructed open style head for easy introduction of small instruments for wax or foreign body removal; Image Magnification: Large slide aside 2.5x lens for clear view of aural structures and procedures under magnification; Five permanent Speculae (diameters: 2.5mm, 3.5mm, 4.5mm, 5.5mm and 8mm); 2.4V models require: 2.4V models require 2x AA batteries to be supplied by user","Unobstructed open style: Unobstructed open style head for easy introduction of small instruments for wax or foreign body removal; Image Magnification: Large slide aside 2.5x lens for clear view of aural structures and procedures under magnification; Five permanent Speculae (diameters: 2.5mm, 3.5mm, 4.5mm, 5.5mm and 8mm); 2.4V models require: 2.4V models require 2x AA batteries to be supplied by user",https://www.keelerglobal.com/wp-content/uploads/2024/08/ledpractitionerotoscope.png,https://www.keelerglobal.com/wp-content/uploads/2024/08/ledpractitionerotoscope.png,,,
1011-P-7042,KEELER,pack-of-four-assorted-colour-handle-sleeves-1011-p,ophthalmology-surgical,active,,Pack of four assorted colour handle sleeves,Pack of four assorted colour handle sleeves,"Add some colour to your diagnostic areaNow available in four funky colours, these grips are not only fun but functional too! Helping our customers bring an end to preventable vision loss. Keeler LtdClewer Hill Road, Windsor, Berkshire SL4 4AA UKTel: +44 (0) 1753 857 177","Add some colour to your diagnostic areaNow available in four funky colours, these grips are not only fun but functional too! Helping our customers bring an end to preventable vision loss. Keeler LtdClewer Hill Road, Windsor, Berkshire SL4 4AA UKTel: +44 (0) 1753 857 177","1 x Pink: 1 x Pink rubber grip; 1 x Green: 1 x Green rubber grip; 1 x Blue: 1 x Blue rubber grip; 1 x Black: 1 x Black rubber grip; Professional Spot Retinoscope: Professional Spot Retinoscope head onlyProfessional Spot Retinoscope head only; Dispos-a-spec wall dispenser: Dispos-a-spec wall dispenser with 25x 2.5mm, 3.5mm, 4.5mm, 5.5mm specula1964-P-2000","1 x Pink: 1 x Pink rubber grip; 1 x Green: 1 x Green rubber grip; 1 x Blue: 1 x Blue rubber grip; 1 x Black: 1 x Black rubber grip; Professional Spot Retinoscope: Professional Spot Retinoscope head onlyProfessional Spot Retinoscope head only; Dispos-a-spec wall dispenser: Dispos-a-spec wall dispenser with 25x 2.5mm, 3.5mm, 4.5mm, 5.5mm specula1964-P-2000",https://www.keelerglobal.com/wp-content/uploads/2024/02/1901-P-7052-16-jpg.webp,https://www.keelerglobal.com/wp-content/uploads/2024/02/1901-P-7052-16-jpg.webp,,,
